,Item (Texto),SesgoMode
86,"Las autoridades pudieron establecer la identidad de la persona a quien pertenecería la cabeza encontrada dentro de una bolsa en el corregimiento de Aguaclara, zona rural de Tuluá, centro del Valle del Cauca. Se trata de un joven llamado Santiago Ochoa. Según se conoce, el joven hacía parte de la denominada primera línea de resistencia de ese municipio. El crimen tiene consternados a los habitantes de esa zona del país. Testigos aseguran que Santiago salió en horas de la mañana en una bicicleta y posteriormente, fue capturado supuestamente por el Escuadrón Móvil Antidisturbios (Esmad).",-1
87,"Este fin de semana se vivió una tensa situación en el país por las manifestaciones y protestas que se vivieron por el paro nacional. En un marco complejo, se vivió una insólita situación en una de las ciudades donde se presentaba protestas. Duranta las manifestaciones en Buenaventura, se conoció un video donde un hombre con flores y globo en forma de corazón se acercaba a una mujer para expresarle su amor. La situación ante la mirada de una multitud de personas que deseaban un final feliz y así lo hacían saber en un coro que decía lo siguiente: “Que diga que sí, que diga que sí”. Aunque en el video no se escucha lo que le dice el hombre a la mujer, lo que si se puede es observar cuando ella le reprocha y le tira tanto las flores como el globo de corazón al piso.",0
88,"Los policías del Esmad son héroes: la acérrima defensa del ministro Molano durante la moción de censura. El funcionario respondió a los ataques que le hizo la oposición, que lo confrontó bajo el argumento de que se ha manejado mal el orden publico durante el paro nacional. Sobre este punto, destacó el papel del Escuadrón Móvil Antidisturbios, en donde dijo que quienes integraban estas unidades eran héroes. “Quiero hablar del Esmad, quien afecta las manifestaciones son los violentos y no el Esmad (…) yo quisiera invitarlos (Congresistas) a que hablaran con un policía del Esmad, los policías del Esmad son unos héroes, 105 países del mundo tienen policía como el Esmad, y la de Colombia es una de las reconocidas, están regulados, tiene entrenamientos formados en derechos humanos, y aún así los tildan como si estuvieran en contra de la sociedad cuando buscan garantizar la manifestación pacífica”, dijo Molano. De igual manera rechazo el prejuzgamiento que ha recibido la fuerza pública durante su actuación en el paro nacional “Por supuesto se nos ha prejuzgado señalado de todo tipo de delitos, mientras que muchas veces la mentira va rápido, se mueve en las redes, a los funcionarios nos corresponde decir la verdad, aquí no se puede tildar al gobierno de estigmatizar la protesta, se ha garantizado, miles de colombianos han salido a marchar, más de 8.000 actividades en más de 700 municipios de Colombia, esa responsabilidad y la asume la fuerza pública con toda garantía”.",1
89,"La frase “Los héroes en Colombia sí existen” se ha tomado las redes. Dichos héroes son los comunes, los de a pie, los que, al juntarse, tienen la potencia de dar luz a un poder político prejurídico e ilimitado, capaz de poner en cintura a los delegatarios, modificar o abolir las instituciones injustas y sentar las bases de una democracia real, en clave social y ecológica. El pueblo es resiliente y valiente. Ha quedado demostrado una vez más que parar, protestar y rebelarse no es un acto estéril; por el contrario, las grandes conquistas siempre han estado precedidas de grandes revoluciones. Con conciencia, porfía y persistencia, el pueblo llano llevó contra las cuerdas al Gobierno, logró tumbar el proyecto de reforma y presionar eficazmente la renuncia de Carrasquilla del Ministerio de Hacienda y Crédito Público. Es una gesta importante, que se integra con otras y deberá completarse con las que siguen. A corto plazo, seguir en paro, presionar la salida de Duque y tumbar los nuevos proyectos de reforma a la salud, en materia pensional y laboral; a mediano plazo, luchar contra las pandemias sociales que ha capitaneado el Estado; a largo plazo, desmontar el Estado inconstitucional, en aras de alzar un nuevo proyecto que sí ampare la vida, la libertad, la igualdad y la felicidad.",-1
90,"De manera análoga, el lunes en la mañana, en Yumbo, al norte de Cali, el ESMAD habría enviado un tanque para terminar la protesta. Utilizan armas de guerra contra civiles desarmados en las calles mientras que, paralelamente, se presentan situaciones diversas; ""Dos motos de la policía se llevaron a Henry[i], uno de nuestros cascos azules"", advierte Jonathan, que, al día de hoy, no tiene noticias suyas. “Queremos que los medios vengan aquí y vean qué está pasando. Esta es nuestra mejor arma: la información"", agrega Peri, también de Paso Resistencia. De hecho, denuncian que la policía está sobornando con dinero a la población a cambio de información sobre la identidad de los jóvenes que constituyen la Primera Línea.",-1
91,"“La Primera Línea es un grupo de jóvenes dispuestos a enfrentarse con escudos, para repeler los ataques policiales contra los manifestantes”, explica Jonathan[1], uno de estos Gavroches latinos, quien hace parte de los 60 a 80 jóvenes presentes en Puerto Rellena, al norte de la ciudad, en la vía que conduce al aeropuerto Alfonso Bonilla Aragón y a la Panamericana, sitio que ha sido rebautizado como Puerto Resistencia y se ha convertido en un lugar emblemático en Cali. Sus escudos: placas de metal, protecciones artesanales hechas con latas abiertas y aplastadas. Sus armas contra la fuerza publica, que los enfrenta con munición letal y tanques: piedras. La situación esta muy lejos de ser como la Guerra de los botones.",-1
92,"La Federación de Empresarios del Transporte de Carga (Fedetranscarga) analizó los viajes de carga realizados entre el 28 de abril, cuando inició el paro, al 15 de junio, y los comparó con el mismo periodo de 2020, fecha en que había en el país algunas restricciones por el aislamiento obligatorio, y encontró que se dio una reducción en la carga de 3,1%.",0
93,"Exportaciones de café cayeron 11 % en junio debido a los bloqueos del paro nacional. Las exportaciones de café de Colombia recuperaron en junio mucho del terreno perdido por los bloqueos y cayeron apenas 11 %, a 986.000 sacos de 60 kg de café verde, frente a un 1,11 millones de sacos exportados en el mismo mes de 2020. Si bien aún no se han podido poner al día las exportaciones de café, sí vale la pena destacar el importante trabajo logístico realizado para alcanzar el nivel actual de envíos, luego de que el principal puerto de Colombia, Buenaventura, por donde sale más del 60 % del café del país, durara más de 40 días bloqueado, explicó el gerente general de la Federación Nacional de Cafeteros, Roberto Vélez Vallejo.",0
94,"Por primera vez en décadas los obreros, campesinos, indígenas y estudiantes se organizaron para protestar al tiempo; la caída de la reforma tributaria en medio de una emergencia fiscal mostró grietas en un modelo económico hasta ahora sólido y la capacidad de los políticos para generar confianza y resoluciones parece más limitada que nunca. Al menos 42 personas han muerto, según la Defensoría del Pueblo. Miles han resultado heridos. Cientos han pasado días desaparecidos. El país ha visto, en vivo y en directo, cientos de abusos policiales y unos cuantos tiroteos entre colombianos.",-1
95,"Tengo la impresión de que los colombianos están aún más polarizados que a inicios del año y que la concordia social, tan necesaria en momentos donde necesitamos una reactivación económica con el esfuerzo de todos, puede desaparecer sin remedio. Muchos leen esta situación como un claro indicio de estallido social, aunque el escaso aforo en las manifestaciones desmienta esa percepción. Más que un estallido, sufrimos una fractura social.",0
96,"Los expertos —incluido el ministro Ruiz— concuerdan en que es difícil saber con exactitud cuánta responsabilidad tienen las protestas en la crisis sanitaria, debido a que el estallido coincidió con varias medidas de reapertura de la actividad económica, y la llegada, comprobada por las autoridades, de al menos dos de las cuatro variantes de covid-19 que exacerban la transmisibilidad.",0
97,"El martes, el ministro de Defensa de Colombia, Diego Molano Aponte, informó a través de su cuenta verificada de Twitter que «vándalos» han quemado el Palacio de Justicia de Tuluá, en el departamento del Valle del Cauca. Hasta el momento no se reportan heridos o muertos.",0
98,"“No crean que estábamos haciendo barricadas, estamos construyendo el país democrático que toda Colombia merece ante la incapacidad actual. De alguna manera las soluciones exploradas por el equipo económico que empieza a trabajar son las que la gente demanda en las calles”, escribió Petro sobre el encuentro. La cantante de tecno carrilera decidió contestar el anuncio de un futuro gobierno que hizo Petro, reiterando las críticas que mantiene en contra del líder político. “Alguien que le diga que está alucinando… Yo quiero fumar de esa que le venden a él a ver si me lanzo a la presidencia”, escribió Marbelle en su cuenta de twitter, en un mensaje que decoró con emoticones de carcajada.",0
99,"Ante la presión internacional de organismos tales como la ONU, Amnistía Internacional o la Comisión Interamericana de los Derechos Humanos, el presidente de Colombia, Iván Duque, anunció el 6 de junio de 2021 una transformación de la Policía colombiana para fortalecer el respeto de los derechos humanos.  La transformación está consignada en un proyecto de ley que será presentado al Congreso, en el inicio de la próxima legislatura, es decir, a mediados del año que viene y en caso que gane los comicios. La respuesta de la bancada progresista fue denunciar lo “estético” de una medida que no va a resolver los problemas de Colombia. Así lo denunció el senador Iván Cepeda: “Ahora el Ministerio de Defensa se llamará Ministerio de Defensa Nacional y Seguridad Ciudadana y la policía tendrá uniforme azul. Esta cosmética la usa Duque para ocultar las masivas violaciones de derechos humanos y la necesidad de cambios estructurales de la policía y las Fuerzas Armadas”.",-1
100,"Antes rivales irreconciliables en las canchas, hoy compañeros en la protesta social. Los hinchas de clubes con historial de largas enemistades en Colombia unieron sus voces para rechazar la realización de la Copa América 2021 que su país debía recibir junto con Argentina. Y lo consiguieron, los fanáticos y la población en general. “¡No se juega, la Copa no se juega!”, gritaron seguidores de distintos equipos con pancartas que rezaban “Si no hay paz, no hay futbol” y lograron lo impensable. Colombia perdió la sede por decisión de la Conmebol y los aficionados al futbol celebran lo que consideran un triunfo social, por encima de sus preferencias deportivas.",0
101,"La manifestación se concentró a las 10 de la mañana en el Puente de la 4 Sur, en el sur de Medellín. De allí arrancó, también por el sur con destino a la estación Itagüí del Metro. Sobre las 4:30 de la tarde, la situación se salió de control cuando, de acuerdo con denuncias y videos en redes sociales, los manifestantes comenzaron a generar daños en algunas estructuras.",0
102,"Pese a que muchas historias han sido tristes, también hay alegres y conmovedoras. En el caso del ‘Capitán Colombia’ se ha generado mucha expectativa, pues aunque se desconoce la identidad, se sabe que participa dentro de la ‘Primera línea’ en las protestas.  Pero en medio de este revuelo también ha sido usado en memes, ha recibido piropos y se roba la mirada de más de una. Muchos lo tildan como el héroe de las protestas, pues se encarga de que estas se lleven a cabo de manera pacífica y cuando se presentan desórdenes, es el primero en salir a defender a la gente que está a su alrededor.  Las manifestaciones que se han dado en Colombia desde el pasado 28 de abril han sido un escenario de múltiples historias y personajes, entre ellos, el famoso ‘Capitán Colombia’.",0
103,"Aunque el Gobierno expresó toda su voluntad para continuar con los diálogos, le solicitó a los líderes del paro nacional, que se adelanta desde hace un mes en Colombia, que se desbloqueen las vías, en beneficio de la población colombiana que se ha visto afectado por este tema.",1
104,"Aunque la desigualdad ya venía empeorando incluso antes de la pandemia, se agigantó entre 2019 y 2020, cuando cayeron en pobreza 375.990 personas en la urbe de 2,2 millones de habitantes. Sin nada que perder, estos mismos jóvenes escalaron el pulso cerrando calles enteras para instalarse en verdaderos campamentos urbanos que exasperan a una buena parte de la población que padece con esos bloqueos.",0
105,"Miembros del Comité Nacional del Paro —un grupo conformado por sindicatos y organizaciones estudiantiles— señaló en conferencia de prensa que suspenderán las marchas que se habían estado realizando cada semana a fin de evitar la muerte de más manifestantes a manos de la policía y también para reducir los contagios de coronavirus en el país, que registra una cifra récord de decesos relacionados con la enfermedad.",0
106,"Petro sí tiene que ver con el paro: Néstor Humberto Martínez. El exfiscal cree que el candidato de la Colombia Humana sí está detrás de las manifestaciones. En la entrevista, la directora de SEMANA, Vicky Dávila, le preguntó a Martínez si para él Petro tiene que ver con el paro, a lo que contestó: “Definitivamente, sí tiene que ver”. Agregó que es un hecho que el senador ha convocado grandes movilizaciones y que las personas más cercanas a él son quienes financian a quienes están en las calles. ""Recordará el país que Petro convocó la marcha más grande de la historia de Colombia. Su gente es la dueña y financiadora de la Primera Línea, es decir, de la confrontación con el Esmad. O sea, forman parte no solamente de las marchas pacíficas, sino de los actos de violencia frente a la autoridad”, comentó. Martínez se refiere a la Vaki que promovió Gustavo Bolívar para entregarles elementos a los marchantes de este grupo.",1
107,"Los expertos consultados por Forbes concluyen que, salvo el retiro de las exenciones tributarias —principalmente, las otorgadas en la tributaria del 2019 a bancos y a ultrarricos; y con las que se podrían conseguir 9 billones de pesos—, no ven de dónde sacar más plata a no ser que sea vía otra reforma tributaria. Parece que a los expertos se les escapó el pequeño detalle de que a Colombia en corrupción se le esfuman 50 billones de pesos anuales. ¿Será que, si dejaran de robar, sí nos alcanzaría?",-1
108,"Atención: delincuentes queman el Palacio de Justicia en Tuluá, Valle del Cauca. Según informaciones recientes, el incendio no pudo ser sofocado pues los bloqueos y los hechos de vandalismo que se vivían en el lugar no permitían el paso de los bomberos. Por eso, muchos de los videos en redes sociales contienen llamados de quienes graban de que dejen pasar al personal de rescate para poder actuar a tiempo... El congresista aseguró que le dolía su ciudad natal y que le pedía a las autoridades y al gobierno nacional hacer lo posible para recuperar el orden. También había denuncias en redes sociales de supuestos excesos de la policía en la represión de la jornada.",0
109,"Las protestas han dejado pérdidas por 3.000 millones de dólares, según el ministerio de Finanzas, debido a que los bloqueos carreteros han impedido que las fábricas reciban materia prima y evitado la exportación de productos como el café y la caña de azúcar.",1
110,"El tire y afloje del liberalismo con Duque ya tiene varios episodios. Desde la despachada de Gaviria (su jefe único) contra Carrasquilla a su posterior invitación “rodear” a Duque. En el Congreso, la bancada se ha movido a ese ritmo. Los representas que apoyaron a Molona fueron: Julián Peinado, cabeza del liberalismo de Envigado (con tres exalcaldes procesados por corrupción) y un incondicional del uribismo. John Jairo Roldán, está en la Cámara desde 2010 y su fortaleza electoral se concentra en Bello y algunos municipios del bajo cauca. Roldán buscará llegar al Senado en 2022 y su fórmula a la Cámara será peinado ¡Tal para cual! Entre los senadores, no extraña el voto del cuestionado Julián Bedoya, aliado del grupo político de la Universidad de Medellín (la misma que le tramitó en tiempo exprés la tarjeta de abogado). Su coequipero en el grupo Renovación liberal, Juan Diego Echavarría (uno de los promotores del fallido proyecto para extenderle el periodo a Duque), se abstuvo de votar.",-1
111,"La Policía entregó el balance de los cinco días de Paro Nacional contra la fallida reforma tributaria del Gobierno Duque. Mientras la institución habla de 504 uniformados lesionados, y asumió decenas de investigaciones internas, Temblores ONG registró 1.181 denuncias por violencia policial.",0
112,"La criminalización del derecho a la protesta, que cuando la única herramienta es cortar una ruta o hacer una manifestación artística empieza la persecución a través de redes sociales, a dispararles, hacerles perder la visión, golpearlos, torturarlos, generarles miedo. No son hechos aislados porque es un política de Estado para que eso ocurra. Hay un aval. El Esmad y la Policía actúan y violan los derechos humanos sabiendo que los van aplaudir y condecorar. También el cerco mediático de los grandes medios de comunicación que victimizan al agresor. Hacen quedar como que los manifestantes son unos vándalos y los que disparan son los buenos y la “gente de bien”. Para los medios, los violentos son los que se están defendiendo con un escudo de chapa, y los buenos son los que están disparando con gases vencidos, a los ojos, los que detienen arbitrariamente y torturan. ",-1
113,"La Minga Nacional, Social, Popular y Comunitaria de Popayán (capital del Cauca, suroeste de Colombia) denunció este lunes, a través de un comunicado, el rechazo al diálogo por parte de la Fiscalía y la criminalización de la protesta.",0
114,"Noche de terror en Tuluá (Valle): un muerto, saqueos y el palacio de justicia incinerado. “Sobre las 10 de la noche se registró la lamentable noticia que tiene que ver con el cuerpo sin vida que llega a un centro asistencial”, dijo el general Rodríguez. “Allí se identifica como Camilo Andrés Arango, de 18 años, estudiante, quien al parecer fallece por arma de fuego. Igualmente, se presenta la agresión de dos ciudadanos con arma de fuego que no se encuentran graves en este momento”, añadió. Por haber una persona muerta, millonarios daños y un ataque directo a la institucionalidad, las autoridades ofrecen hasta $100 millones de pesos de recompensa a quien dé información que conduzca a los responsables de los hechos violentos del pasado 25 de mayo.",0
115,"Personería de Medellín lleva 216 revisiones de lacrimógenos del Esmad sin encontrar gases vencidos. Según el funcionario, hasta el momento se han registrado tres denuncias en tal sentido, pero desde el ente con funciones de Ministerio Público en la capital antioqueña no se puede confirmar si los señalamientos son ciertos.",1
116,"El paro nacional ha dejado un saldo de 21 víctimas mortales confirmadas que guardan relación con las manifestaciones. Esta es una cifra terrible a la que debe sumarse la de más de 2.000 heridos, hechos que sumaron una presión adicional a un sistema hospitalario ya de por sí copado por el pico de la pandemia. En un país como el nuestro, donde el valor de la vida siempre ha sido relativo, volver a las épocas donde la ideología de alguien era una lápida a cuestas es muy triste. El paro agudizó la polarización hasta puntos nunca antes vistos",0
117,"El mandatario Iván Duque apuntó que si bien se debe garantizar derechos ciudadanos como la protesta pacífica, un Estado no debe tolerar ""el vandalismo, el terrorismo urbano de baja intensidad, que amenazan el orden constitucional"".",1
118,"El último informe de Monitoreo de Riesgos y Prevención de Afectaciones a los Derechos Humanos en Colombia de la JEP resalta el ""surgimiento de prácticas de autodefensa y paramilitarismo para atemorizar a las personas que participan en la protesta social"". La entidad informó que tienen evidencias del surgimiento de ""grupos de civiles armados"" en al menos 27 ciudades que realizaron 56 acciones violentas entre el 28 de abril y el 30 de mayo pasados.",0
119,"Desde que los grupos económicos manejen los medios de comunicación no habrá posibilidad de cambio. Jamás la habrá. Por eso, cuando ustedes prendan el televisor, llorarán porque le quemaron un banco a Sarmiento Angulo, se enternecerán al ver a los Esmad, tan buenos católicos, arrodillados rezándole a un Dios de la muerte. La protesta una vez más estará compuesta de marihuaneros desadaptados, desarrapados como Dilan Cruz que bien muerto está. En el país de Sarmiento Angulo los pobres son solo carne de cañón.",-1
120,"Allí, por ley, los detenidos deben contar con la presencia del Ministerio Público para verificar el respeto de los derechos humanos. ""Pero lo que hemos visto durante el Paro Nacional es que la Policía ha conducido a las personas a otro tipo de instalaciones, e incluso, como en Pereira, a centros clandestinos de detención”, explica Lanz. El otro tipo de detenciones que pueden estar llevando a reportes de desaparecidos son ""las capturas de manifestantes o personas que se encuentren cerca de los lugares de protesta, que son directamente acusados de delitos como terrorismo sin que existan evidencias de ello”. Y precisamente porque, según Temblores, ni la Defensoría del Pueblo ni la Personería ni la Procuraduría están actuando, esa ONG anuncia el lanzamiento de ""un plan de emergencia en búsqueda de los desaparecidos”.",-1
121,"Así, ha urgido a las autoridades colombianas a realizar investigaciones ""inmediatas, efectivas e independientes"" en referencia a las violaciones a los Derechos Humanos y los abusos cometidos desde el 28 de abril y, como resultado, que los responsables rindan cuentas.",0
122,"El desgarrador relato de Ángel Campos, patrullero a quien intentaron quemar vivo durante el paro. El uniformado resultó quemado por una bomba tipo molotov en medio de los fuertes disturbios del miércoles en Bucaramanga. Otros dos patrulleros resultaron heridos en los actos vandálicos. Rechazamos los actos vandálicos y criminales registrados esta noche contra la vida e integridad de nuestros policías en Bucaramanga. Tres compañeros resultaron heridos con bombas incendiarias y objetos contundentes”, dijo la Policía en Twitter, tras lo acontecido en la capital de Santander. “Era una reunión de amigos, de camaradas”: Líder social Diana Parafán critica encuentro de CIDH con víctimas. El uniformado perteneciente al Esmad dijo estar bastante deprimido y afectado psicológicamente por lo acontecido contra su vida este miércoles, pues no llegó a pensar que una situación de esas le fuera a pasar a él. “Esperaba que mi familia me esperara en mi casa, que hoy que estoy cumpliendo un año más de vida pudiera estar compartiendo con ellos”, dijo el uniformado, quien se recupera en un clínica.",0
123,"la verdad es que la situación se está poniendo color de hormiga cuando el presidente, en forma irresponsable como cualquier advenedizo improvisador, desata afirmaciones insensatas e imprudentes en las redes sociales, asegurando sin pruebas que el jefe de la oposición es el causante, responsable y culpable de los bloqueos a los que han tenido que acudir algunos protestantes del paro para poder hacer oír su voz, en lo que va corrido durante el mes de mayo, utilizando el jefe del Estado la mentira y el miedo de la manera más irresponsable como arma de propaganda política para ganar las elecciones en el 2022.",-1
124,"Son ellos, los que viven de las rentas del Estado y las empresas, los que manipularon a los jóvenes sin estudio y perjudicaron con su discurso político y desinformado a quienes están buscando conseguir su primer empleo, a quienes se encuentran en condiciones de pobreza, a quienes mantuvieron sus empleos por el subsidio a la nómina que salvó a las empresas para las que trabajan y, a los cuales, es importante aclarar, les hubieran mejorado sus condiciones de vida, si se hubiese aprobado una reforma tributaria que ni siquiera permitieron discutir. No se dejen manipular, abran los ojos, ellos no los representan. Son ellos quienes con mezquindad e intereses políticos están manipulando la información, adueñándose de sus angustias y reclamos, con el fin obtener prebendas y poniendo en grave riesgo a toda una sociedad.",1
125,"En un barrio del sur de Cali, civiles se armaron con pistolas y fusiles para disparar contra algunos manifestantes, con policías a su lado. Argumentan que querían cuidar sus ""bienes"" de la ira popular. Tras 50 días de protestas, el odio de clases quedó descubierto en la tercera ciudad más importante del país Colombia y que se suma a las problemáticas de desigualdad y racismo. Escobar fue uno de los que sacó su arma. Asegura que hizo ""unos disparos al aire"" con una pistola automática, en la más sangrienta jornada del llamado paro nacional, que dejó 13 muertos en la ciudad.",0
