,Item (Texto),SesgoMode
214,"El sistema de transporte público en Colombia está viviendo uno de sus momentos económicos más complicados. La reducción de los pasajeros a expensas de la pandemia trajo consigo un hueco difícil para cubrir. Según el presidente de Metrocali -Entity responsable de la operación de los integrados.Masivo de Occidente (Mio) -, Oscar Ortiz, las empresas perdieron alrededor de $ 2.2 mil millones en 2020 debido al virus. Sin embargo, este año las cosas se complicaron aún más, porque los actos vandalicos contra las estaciones y los autobuses se agregaron a la pandemia.Atacado por más de un mes de protesta social en el país. En Cali, Bucaramanga, Pereira, Bogotá, entre otras ciudades, las pérdidas han sido millones de dólares y la oferta del servicio cayó al daño que había en los elementos de los elementos deel sistema.",0
215,"La CIDH también documentó la preocupación de los colombianos en las interrupciones del servicio de Internet en el contexto de las protestas. Según dicho, esto habría generado un escenario de obstrucción de las quejas sobre el acto de la fuerza pública. Los informes recibieron enseñar tanto el posible uso de la tecnología destinada a inhibir o restringir la señal de Internet, como el bloqueo de las direcciones de Internet que contenían información sobre las protestas. Otra preocupación por la Comisión de Tecnología es la repetida queja que recibió el perfil de los usuarios de redes sociales, participantes o no de las protestas. Alcanzó que ""caracterización genérica a través de términos como el terrorismo, el vandalismo o los delincuentes estigmatiza los principios, activa un entorno hostil al ejercicio de la protesta y la libertad de expresión en Internet. La Relatoría Especial para la Libertad de Expresión ha indicado que las sanciones penales por la La difusión de supuestamente información falsa podría presentar la región a una lógica de criminalizar expresiones sobre temas de interés público y establecer una herramienta con un fuerte efecto inhibitorio.",-1
216,"El ministro, Diego Molano, salió en defensa del papel de la fuerza pública. Durante la intervención de él, el funcionario reiteró que durante los actos violentos ha habido interés en las organizaciones en el margen, como las disidencias de las FARC y el Eln. Explicó que en Cali, Medellín, Popayán y Bogotá, se han dado ataques sistemáticos a las entidades estatales, como la Oficina del Defensor del Pueblo, la Oficina, la Oficina del Fiscal General, las acciones que están totalmente organizadas, no por manifestantes pacíficos sino por las organizaciones de criminales, En hechos que reiteraban son terroristas. ""¿Quién está detrás de la violencia, atacar a entidades? Vamos a identificar a los responsables, los encontraremos y los enfrentaremos a ellos. No son suposiciones o hipótesis, los disidentes y el ELN se demuestran como el caso del alias Jacobo, quien ""Estaba alentando al odio en las redes sociales"", dijo el funcionario. Asimismo, Molano insistió en que las protestas pacíficas se respetarán en el país, pero los actos violentos que comentan sobre los vándalos se lucharon.",1
217,"En Bogotá, la mayoría de los engranajes se han llevado a cabo en las carreteras principales, afectaron la operación de transmilenio y, por lo tanto, los usuarios que han tenido que bajar del sistema de transporte y caminar a casa. Es por eso que ahora los bogotanos afectados pueden pedir un reembolso de ese pasaje queNo pudieron usar, pero que si se validaban en los armarios de las estaciones. ¿Cómo solicitar la reincorporación de mi pase en Transmilenio? Esta soledad se realiza para las personas que pagaron su paso, pero no pudieron completar su movilización por elEl sistema o si no abordaron ninguno de los autobuses durante las marchas que se han realizado desde el 28 de abril en la ciudad.",0
218,"El ministro de la justicia colombiana, Wilson Ruiz Orejuela, ha defendido la acción policial el martes durante las protestas que han tenido lugar en el país desde el pasado.
Abril contra el gobierno del presidente, Ivan Duque, y ha descartado cualquier paralelo con Chile, especialmente antes de la posibilidad de reforma constitucional.",1
219,"Por supuesto, debemos tener en cuenta que, en hechos, como los que ocurrieron en Colombia durante el último mes, los hogares no son el objetivo del vandalismo. Sin embargo, terminan en la ola, en las inmediaciones con los puntos focales, que,En este caso, han sido las estaciones y los vehículos de los sistemas de transporte; bienes en el espacio público como estatuas que forman parte de los símbolos de algún hecho histórico en el país; los vehículos, entre otros.",0
220,"A primera vista, todo lo que Petro ha dicho es claramente una exageración o una mentira. Sin embargo, en un entorno hervido y violento, sus palabras se vuelven gasolina, y lo único que hacen es que la luz odia más en un momento en que los colombianos exigen la grandeza y los sensibilizantes.Demanda, principalmente jóvenes. Para esta razón, Petro está mal y está jugando, literalmente, con fuego: lo que hoy puede hacerlo popular mañana podría pasar una factura costosa en términos políticos y dejarlo sin opciones en las presidenciales.",1
221,"La Asociación del Sector Automotriz y sus Partes (Asopartes) encendió nuevamente las alarmas en nombre de las afecciones presentadas por el sector de fabricación y montaje de vehículos después de varias semanas de desempleo nacional en el país. Este tipo de situaciones en la cadena logística y adquisición.de
Las materias primas, según Asorparts, están representando disfraces de
Hasta el 500%, por eso, en algunos casos, los precios finales al consumidor podrían aumentar cuatro o cinco veces.",0
222,"La tarde de este jueves 17 de junio, Cali vivió un nuevo día de protestas donde se registraron los problemas de orden público. Un autobús del sistema de transporte MIO, que cubrió la ruta P27, fue quemada por encapuchada en la calle 70 con la carrera 1, en el camino.que se comunica a la ciudad de Cali con el municipio de Palmira. El vehículo de transporte público se atravesó en la carretera.",0
223,"La familia de Santiago Ochoa ya ha reconocido los restos, pero la confirmación de la medicina legal es necesaria para el proceso judicial por desaparición de que la fiscalía debe avanzar "". En el caso de que mi sobrino pertenezca a la primera línea o que tenga que ver enEl desempleo o que el Esmad lo secuestró es totalmente falso. De cualquier información, hemos dado autorización o permiso para recaudar dicha información falsa "", dijo el miembro de la familia de Santiago Ochoa. El Pregunte Ivan Duke rechazó los hechos y pidió avanzar en la investigación para dar con elculpables.",0
224,"Police herida durante los disturbios en Bogotá. Según General Gómez, había ""doce hombres heridos de nuestra policía nacional, algunas temporadas, los portales fueron igualmente atacados"". Una vez uniformados, se lesionó, una estación de policía vandalizada y varias casas y locales comerciales afectados en Madrid, en Cundinamarca. Durante cinco horas, la estación de tranquilidad, donde había 21 agentes, fue atacada violentamente. Los vándalos lanzaron piedras e incluso artefactos explosivos. ""Una turba de aproximadamente 200 y 250 personas que vienen directamente para atacar las instalaciones de la policía, afectan directamente a nuestros policías, lanzando piedras, bombas Molotov y otros elementos para dañar su integridad y dañar las instalaciones de la policía"", dijo el coronel. César Castro, comandante de la institución en Cundinamarca. Se vandalizaban tres patrullas, once motocicletas particulares y que estaban en la estación por procedimientos o requisitos judiciales fueron incinerados y se uniformaron once. Los trasladaron al Hospital General de la Policía.",0
225,"""Soy una buena persona"", dice Andrés Escobar, el hombre que disparó en Cali: Andrés Escobar dijo que la policía apreció su ""solidaridad"", y le permitió a esta persona hacer los disparos. Se aseguraron esto, diferentes defensores de los derechos humanos asegurenque la policía, además de disparar, permitió que otros ciudadanos lo hicieran. Esos ciudadanos eran los ciudadanos, quien dijo que lo hizo para ""defender la propiedad privada de mi comuna"" y que lo que él consideraba ""normal para cualquier humano.Siendo. Era consciente de que me estaban filmando "".",1
226,"En su turno, el analista político Julián Peña enfatiza que todos los gobernantes deben propensar constitucionalmente para el orden público y la seguridad de la ciudadanía, incluidos aquellos que han tenido una postura de apoyo y diálogo con los manifestantes "". Varios alcaldes dedicados a hacer política, maltratamiento.La fuerza pública, porque era popular. Ahora se sienten tumbas entre sus propuestas y sus obligaciones constitucionales "", dice.",1
227,"Las protestas sin precedentes, ya completas casi un mes, han resultado de control sobre la relave la violencia y tienen al borde de la bancarrota de millones de personas y empresas en el país, aunque muchas de las demandas de los manifestantes son justas.",1
228,"En opinión del analista, si se mide con esa vara, el saldo del Congreso es Bitters, porque aunque las iniciativas se hundieron tan impopulares como las reformas fiscales y de salud, y el proyecto que buscó la extensión del período presidencial, otros relacionados con la educación.El entorno y el desarrollo del acuerdo de paz se dejaron en que veremos. En términos de control político, aunque el Ministro de Defensa, Diego Molano, fue citado para responder por los excesos de la fuerza pública durante el desempleo, finalmenteSe las arregló para preservar su posición.",-1
229,"Un panorama de que la propia fundación indicada ha transcurrido en medio de estigmatizaciones y agresiones por parte de los miembros de la fuerza pública y bajo un total silencio del gobierno y las autoridades. Después de que los disturbios y demostraciones se redujeron en la última vez, el Defensor del Pueblo anunció queAvanzará un día de recepción de quejas y quejas abiertas a periodistas y reporteros gráficos que fueron víctimas de agresiones y restricciones a su oficina en el marco de THESTP, comenzó el 28 de abril.",-1
230,"Aunque hubo varias iniciativas que no pudieron prosperar en el Congreso, el hundimiento del proyecto de matrícula cero planteó a las ampollas. La iniciativa buscó que la matrícula de estudiantes universitarios de strata de baja mentira estudiaban en las universidades públicas "". Los uriistas mayoritarios en el Senado dan su espalda.Regreso a los jóvenes "", dijo el senador Antonio Sanguino (Green Alliance), uno de sus autores. Para su parte, Gustavo Bolívar (coalición decente) declaró que persistirán en el proyecto en el período que comienza el 20 de julio, peroLlamó la atención por su pequeño apoyo en el Congreso. ""Seguiremos intentando, pero con estas minorías es imposible"", dijo.",-1
231,"El presidente de Colombia, Ivan Duque, anunció este domingo (06.06.2021) que estructurará a la policía, que está bajo la lupa de la comunidad internacional para la dura represión, lo que deja más de 60 muertes en las protestas de las últimas semanas..Durante una ceremonia de promociones de la institución, el Presidente ordenó la creación de ""un decreto que modernizará la estructura orgánica de la Policía Nacional, especialmente para fortalecer la política (...) de los derechos humanos"".",0
232,"""Aunque los medios de comunicación colombianos se abstienen de informar sobre la represión arbitraria y las violaciones sistemáticas por la policía, muchas organizaciones de defensa de los derechos humanos han denunciado incansablemente la situación. Incluso la población colombiana, a través de las redes sociales, continúa día tras día exponiendo los hechos de la violencia extrema enLas manos de la policía y el ejército "", dijo la asamblea en un documento publicado en junio.",0
233,"""El Fiscal General de la Nación capturó, con la Policía Nacional, nueve personas. Con tres personas involucradas en el ataque ardor y terrorista contra el palacio. Se impuso una medida de seguridad en el centro de la prisión por el juez de garantías"", dijo el Fiscal Barbosa.",0
234,"Por esta razón, hoy defiende el desempleo y justifica los bloqueos, afirmando que no hay otra forma en que ""detengan las bolas"". Las solicitudes, a diferencia de lo que se exige en las calles de las grandes ciudades, parece básico: carreteras en buen estado, acueducto, alcantarillado, una universidad pública para la región, porque sus hijos no apuestan por la coca o la seguridad, no sean prisioneros de los armados "". Lo que vemos son promesas fallidas. En las elecciones que prometen la inversión social y nunca llegan.Se ha cumplido con el total de abandono. Estamos en total abandono. Me quemo la espalda para cargar y cargar las piñas a medida que la agricultura y nadie compra "".",-1
235,"Los hechos de los acusados de Andrés Escobar, supuestamente accionista de una agencia de publicidad, ocurrieron el 28 de mayo en la calle 16 con la Carrera 102; en las mediaciones a la CAI de la policía en ese barrio del sur. El hecho generó mucha controversia.Además, porque los civiles que dispararon armas de fuego se publicaron junto con los miembros de la fuerza pública sin que este último evite el ataque armado contra los ciudadanos que se manifestaron en el marco del desempleo nacional; que fue un mes ese día. Las declaraciones de él han recibido elApoyo a un sector de la sociedad, así como las críticas de otras personas de la opinión pública. Por la parte de ella, Catherine Juvinoo, el activista político y el consultor de comunicación política declararon que Escobar muestra una mentalidad paramilitar. Ella ilustra claramente la mentalidad paramilitar.; La justicia por mano es normal; La protesta se reduce a una manifestación de vandalismo "".",-1
236,"Este domingo hay nuevas manifestaciones contra los bloqueos: un día de paz y un carnaval de la vida. El Comité de Movilización 30 de mayo # Yoprotejomipa, convocado, para este domingo, dos marchas en dos puntos diferentes de la ciudad de Bogotá para protestar contra los bloqueos, lo queHan causado una escasez de algunos productos en tiendas y supermercados. El objetivo principal de estas movilizaciones, como se indica, es decir al país: ""No más violencia o más sangre, busque la unión de empresarios, comerciantes, jóvenes y diferentes gremios.""",0
237,"Después de más de 50 días de demostraciones en la capital del Valle de Cauca, varios hechos de la violencia, la discriminación y el clasismo han revelado una división social profunda en Cali. Uno de esos eventos ocurrió en el barrio de la ciudad del 28 de mayo, cuando los civiles armados,En la empresa de la policía, despedida contra los manifestantes.",-1
238,"Los colombianos vieron los bloqueos que la CIDH no vio; la brutalidad de las capuchas que impidieron la movilización de personas, bienes, alimentos y ambulancias; y pagaremos todo el costo de billonarios de la quiebra de las empresas, la pérdida de empleos y la crisis económica. Eso es¿Por qué insulta la inteligencia de que tal nivel de ""terrorismo económico y social"", aunque el terrorismo no está en su diccionario, se disfruta como ""recortes de ruta"" y se recomienda al gobierno ""abstenerse de prohibirlos como a priori"", con lo queCIDH legitima los bloqueos y desprecia los derechos de las mayores. Los ""cortes viales"" de la CIDH son como las ""retenciones"" de las FARC, la invención del JEP para disfrazar al secuestro y aplicar su impunidad de justicia restaurativa. Dos instituciones que se comunicanEn el sesgo ideológico de la izquierda y, por lo tanto, ver por un ojo.",1
239,"A través de un comunicado, el Fiscal General de la Nación, el Contralor de la República y el Fiscal General de la Nación emitieron un comunicado de cinco puntos en el que advierten a los manifestantes sobre la posibilidad de incurrir en un delito al bloquear el camino obstruyendo.Además, señalaron que los funcionarios podrían sumergirse en sanciones para sorprenderse al cometer esos comportamientos.",1
240,"Tanto la ONU como la Unión Europea y varios países llamaron un diálogo grave el sábado como una solución a la crisis y para evitar más violencia y morir más personas, después de 13 homicidios se confirmó el viernes en Cali después de un día de enfrentamientos con la policía y elIrrupción de civiles armados en las protestas.",0
241,"El vicepresidente técnico de FaceColda indicó que ""sin lugar a dudas, aquellos que se vieron afectados y contaron con el seguro, se minimizarán el impacto del daño causado por el vandalismo. Tanto que no tenía seguro, debería asumir estos daños de su propio bolsillo.""",0
242,"A través de los mensajes recibidos por las redes sociales y las llamadas telefónicas, Gustavo Orozco, uno de los promotores de la Marcha del silencio que solicitó en Cali por el cese de la violencia fuera del desempleo nacional, recibió las amenazas de muerte nuevamente.",0
243,"Rechazamos la formación de niños por la primera línea: Mindefense.minister Diego Molano indicó que los menores deben estar en casa o en la escuela, pero no ser adoctrados por los adultos. Se han generado algunos videos donde se ven los niños y menores, lo que está capacitado por miembros.de la primera línea en algunas ciudades como Cali y Medellín. Con la situación, el Ministro de Defensa, Diego Molano se unió a las voces que condenaron estas capacitaciones e indicó que los menores deberían estar en casa con los padres, en la escuela estudiando, pero no serAdoctrinado por adultos o por clase de grupos.",1
244,"La CIDH vio excesos de fuerza de las autoridades, pero no el vandalismo sistemático que devasó las ciudades; Hizo acusaciones de violencia étnica, pero no vio que los pueblos indígenas que bloqueaban y destruidos, prevalecían de su ""autonomía""; Cuestionó la asistencia militar militar y la justicia penal, acusó falsamente al gobierno para estigmatizar la protesta y los jóvenes, e incluso resultó ser la fuerza pública. El que atacó misiones médicas y ambulancias bloqueadas. ¡No hay derecho!. Y, por supuesto, tuvo tiempo para un ""pequeño hombre"" para él protegido de él Petro de él, reiterando su vergüenza legal de atacar al fiscal general y extendiendo la patente corsaria, como ""indisciplinario"", funcionarios de las elecciones populares. No hace falta decir acerca de las recomendaciones, que parecen copiadas del desempleo. La ""neutralización"" de la ESMAD y la transferencia de la policía al Miniinterior son intromisiones arrogantes e inadecuadas. La CIDH no quiso ver los intereses transnacionales que buscan implementar el comunismo en Colombia, y con su actitud ""buena"", el mundo recibió la imagen de una dictadura a Maduro y Ortega, quienes buscaban aquellos que quieren ser erigidos más adelante en Salvadores socialistas, algo que, después de la pandemia y el desempleo, el país no se resistiría.",1
245,"... Las imágenes fueron reportadas y difundidas sobre las movilizaciones ciudadanas, que fueron reprimidas por la policía, en el sector de Calima, de la misma ciudad. Además de Cali, había protestas en Palmira, también en Valle del Cauca, donde denunciaron unLa sangrienta represión por parte de las fuerzas de seguridad contra el descontento. Citizens publicó videos sobre las redes sociales y denunció que varias personas se lesionaban. En ese mismo espacio también hubo informes de presumidas capturas y desapariciones, aunque no se conocen figuras.",-1
246,"Según los especialistas consultados, el arresto nacional también evidenció un aumento en el nivel de participación política y social de varios sectores civiles del país, como contrapeso a la falta de respuestas rápidas y concretas por parte de varios líderes a las necesidades de sugobernado y agudo de la crisis de credibilidad en las instituciones.",-1
247,"""Tenemos varios temas para aclarar. El número equivocado de personas mató a desempleados porque se ha demostrado que se demuestra que hay 24 personas que murieron por desempleo, pero 19 no murieron debido al desempleo y 11 están en la investigación. Cuando dice la Sra. Bachelet.""Hay 54 muertos por el desempleo, ella está equivocada y que duele al país porque el país lo que quiere es la verdad de no seguir trabajando en los rumores"", dijo el embajador.",1
248,"Las autoridades podrían establecer la identidad de la persona que pertenezca la cabeza encontrada dentro de una bolsa en el Corregimiento de Aguaclara, la zona rural de Tuluá, el centro del valle del Cauca. Es un joven llamado Santiago Ochoa.as, es conocido, laEl joven era parte de la llamada primera línea de resistencia de ese municipio. El crimen ha consternado a los habitantes de esa área del país. Dicen que Santiago salió por las horas de la mañana en una bicicleta y más tarde, supuestamente fue capturada porEl escuadrón anti-tisturbano móvil (ESMAD).",-1
249,"Este fin de semana se experimentó una situación tensa en el país por las manifestaciones y las protestas que vivían por el desempleo nacional. En un marco complejo, se vivió una situación inusual en una de las ciudades donde se presentaron protestas. Dura las manifestaciones en Buenaventura,Se conocía un video donde un hombre con flores y un globo en forma de corazón se acercaba a una mujer para expresar su amor. La situación ante la mirada de una multitud de personas que querían un final feliz y, por lo tanto, hágale saber en un coro que decía lo siguiente.: ""¿Qué dices sí, qué dices?"" Aunque en el video no se escucha lo que el hombre le dice a la mujer, y si se puede observar cuando le reprocha y lanza ambas flores como el globo del corazón.",0
250,"Los oficiales de policía son héroes: la firme defensa del Ministro Molano durante el movimiento de la censura. El funcionario respondió a los ataques que la oposición lo hizo, quien lo enfrentó bajo el argumento de que la Orden Pública ha sido manejada durante el desempleo nacional. En este punto, destacó el papel del escuadrón anti-tisturbano móvil, donde dijo que aquellos que integraron estas unidades eran héroes. ""Quiero hablar de la ESMAD, que afecta a las manifestaciones son violentas y no a la ESMAD (...), me gustaría invitarlos (congresistas) a hablar con un policía de ESMAD, los oficiales de policía son algunos héroes, 105 países de El mundo tiene a la policía como la ESMAD, y la de Colombia es una de las reconocidas, se regulan, tiene capacitación formada en derechos humanos, e incluso así, así como si estuvieran en contra de la sociedad cuando buscan garantizar la manifestación pacífica "", dijo Molano. . De la misma manera el rechazo del prejugrado de que la fuerza pública ha recibido durante su acción en el desempleo nacional ""Por supuesto, hemos sido prejuzgados de todo tipo de delitos, mientras que muchas veces la mentira va rápido, se mueve en las redes, a la Los funcionarios nos corresponden a decir la verdad, aquí no se puede atar a estigmatizar la protesta, se ha garantizado, se han garantizado miles de colombianos, más de 8,000 actividades en más de 700 municipios de Colombia, esa responsabilidad y asume que fuerza pública. con cada garantía "".",1
251,"La frase ""Los héroes en Colombia existen"" se han tomado las redes. Dichos héroes son los comunes, los de los pies, los que, al unirse, tienen el poder de dar luz a un poder político prejurido y ilimitado, capaz de administrar a los delegados, modificar o abortar las instituciones injustas y poner las bases de una democracia real. , En una clave social y ecológica. La ciudad es resistente y valiente. Se ha demostrado una vez más que detener, protestar y rebelarse no es un acto estéril; Por el contrario, las grandes conquistas siempre han sido precedidas por grandes revoluciones. Con conciencia, pórfida y persistencia, las personas simples lideraron contra las cuerdas al gobierno, lograron acostar el proyecto de reforma y presionar de manera efectiva la renuncia a la Carrasquilla del Ministerio de Finanzas y el Crédito Público. Es un gesto importante, que está integrado con otros y debe completarse con los que siguen. A corto plazo, permanecen desempleados, presione la salida de Duke y derriba los nuevos proyectos de reforma de salud, en cuestiones de pensiones y laboristas; A mediano plazo, lucha contra las pandemias sociales que ha capturado el estado; A largo plazo, desmantelando el estado inconstitucional, con el fin de plantear un nuevo proyecto que protege la vida, la libertad, la igualdad y la felicidad.",-1
252,"Análogamente, el lunes por la mañana, en Yumbo, al norte de Cali, el esquad habría enviado un tanque para terminar la protesta. Use las armas de guerra contra civiles desarmados en las calles, mientras que, en paralelo, se presentan diversas situaciones; ""Dos bicicletas de la policíaTomó Henry [I], uno de nuestros cascos azules "", dice Jonathan, quien, hasta este día, no tiene noticias"". Queremos que los medios vengan aquí y veamos lo que está sucediendo. Esto es nuestra mejor arma: información "",Agrega Peri, también de la resistencia al paso.De hecho, denuncian que la policía está sobornando con dinero a la población a cambio de información sobre la identidad de los jóvenes que constituyen la primera línea.",-1
